{
  "$id": "https://example.invalid/mcpaudit/20260731-evidence-conservation-v2/CoverageDeltaV1.schema.json",
  "$schema": "https://json-schema.org/draft/2020-12/schema",
  "additionalProperties": false,
  "allOf": [
    {
      "if": {
        "properties": {
          "admission_state": {
            "const": "ADMITTED"
          }
        },
        "required": [
          "admission_state"
        ]
      },
      "then": {
        "properties": {
          "candidate_state": {
            "const": "TERMINAL_ADMITTED"
          },
          "prerequisite_state": {
            "const": "SATISFIED"
          },
          "reviews": {
            "allOf": [
              {
                "contains": {
                  "properties": {
                    "review_type": {
                      "const": "ORACLE_CONTRACT"
                    }
                  },
                  "required": [
                    "review_type"
                  ]
                },
                "maxContains": 1,
                "minContains": 1
              },
              {
                "contains": {
                  "properties": {
                    "review_type": {
                      "const": "FIXTURE_REPRODUCIBILITY"
                    }
                  },
                  "required": [
                    "review_type"
                  ]
                },
                "maxContains": 1,
                "minContains": 1
              }
            ],
            "items": {
              "additionalProperties": false,
              "properties": {
                "completed_at": {
                  "minLength": 10,
                  "type": "string"
                },
                "decision": {
                  "const": "APPROVE"
                },
                "independent": {
                  "const": true
                },
                "receipt_id": {
                  "pattern": "^review-[a-z0-9-]+$",
                  "type": "string"
                },
                "review_type": {
                  "enum": [
                    "ORACLE_CONTRACT",
                    "FIXTURE_REPRODUCIBILITY"
                  ]
                },
                "reviewed_content_sha256": {
                  "pattern": "^[0-9a-f]{64}$",
                  "type": "string"
                },
                "reviewed_spec_sha256": {
                  "pattern": "^[0-9a-f]{64}$",
                  "type": "string"
                },
                "reviewer_id": {
                  "pattern": "^v2-[a-z0-9-]+$",
                  "type": "string"
                }
              },
              "required": [
                "receipt_id",
                "reviewer_id",
                "review_type",
                "decision",
                "reviewed_content_sha256",
                "reviewed_spec_sha256",
                "completed_at",
                "independent"
              ],
              "type": "object"
            },
            "maxItems": 2,
            "minItems": 2,
            "type": "array",
            "uniqueItems": true
          }
        }
      }
    },
    {
      "if": {
        "properties": {
          "admission_state": {
            "const": "REJECTED"
          }
        },
        "required": [
          "admission_state"
        ]
      },
      "then": {
        "properties": {
          "candidate_state": {
            "const": "TERMINAL_REJECTED"
          },
          "reviews": {
            "contains": {
              "properties": {
                "decision": {
                  "const": "REJECT"
                }
              },
              "required": [
                "decision"
              ]
            },
            "minItems": 1
          }
        }
      }
    },
    {
      "if": {
        "properties": {
          "admission_state": {
            "enum": [
              "PENDING_INDEPENDENT_REVIEW",
              "BLOCKED_PREREQUISITE"
            ]
          }
        },
        "required": [
          "admission_state"
        ]
      },
      "then": {
        "properties": {
          "candidate_state": {
            "const": "READY_FOR_INDEPENDENT_REVIEW"
          }
        }
      }
    },
    {
      "if": {
        "properties": {
          "candidate_state": {
            "const": "TERMINAL_ADMITTED"
          }
        },
        "required": [
          "candidate_state"
        ]
      },
      "then": {
        "properties": {
          "admission_state": {
            "const": "ADMITTED"
          }
        }
      }
    },
    {
      "if": {
        "properties": {
          "candidate_state": {
            "const": "TERMINAL_REJECTED"
          }
        },
        "required": [
          "candidate_state"
        ]
      },
      "then": {
        "properties": {
          "admission_state": {
            "const": "REJECTED"
          }
        }
      }
    },
    {
      "if": {
        "properties": {
          "admission_state": {
            "const": "ADMITTED"
          },
          "schema": {
            "const": "CoverageDeltaV1"
          }
        },
        "required": [
          "schema",
          "admission_state"
        ]
      },
      "then": {
        "properties": {
          "body": {
            "properties": {
              "entries": {
                "items": {
                  "properties": {
                    "review_status": {
                      "const": "COMPLETE"
                    }
                  },
                  "required": [
                    "review_status"
                  ]
                }
              }
            }
          }
        }
      }
    },
    {
      "if": {
        "properties": {
          "admission_state": {
            "enum": [
              "PENDING_INDEPENDENT_REVIEW",
              "BLOCKED_PREREQUISITE"
            ]
          },
          "schema": {
            "const": "CoverageDeltaV1"
          }
        },
        "required": [
          "schema",
          "admission_state"
        ]
      },
      "then": {
        "properties": {
          "body": {
            "properties": {
              "entries": {
                "items": {
                  "properties": {
                    "review_status": {
                      "const": "PENDING_INDEPENDENT_REVIEW"
                    }
                  },
                  "required": [
                    "review_status"
                  ]
                }
              }
            }
          }
        }
      }
    }
  ],
  "properties": {
    "admission_state": {
      "enum": [
        "PENDING_INDEPENDENT_REVIEW",
        "BLOCKED_PREREQUISITE",
        "ADMITTED",
        "REJECTED"
      ]
    },
    "body": {
      "additionalProperties": false,
      "properties": {
        "control_counts": {
          "const": {
            "covered": 3
          }
        },
        "entries": {
          "maxItems": 21,
          "minItems": 21,
          "type": "array"
        },
        "new_claim": {
          "minLength": 1,
          "type": "string"
        },
        "package_id": {
          "const": "20260731-evidence-conservation-v2"
        },
        "primary_counts": {
          "const": {
            "covered": 11,
            "cross": 1,
            "partial": 6
          }
        },
        "schema": {
          "const": "CoverageDeltaV1"
        },
        "unmapped": {
          "const": 0
        }
      },
      "required": [
        "schema",
        "package_id",
        "primary_counts",
        "control_counts",
        "unmapped",
        "entries",
        "new_claim"
      ],
      "type": "object"
    },
    "candidate_state": {
      "enum": [
        "READY_FOR_INDEPENDENT_REVIEW",
        "TERMINAL_ADMITTED",
        "TERMINAL_REJECTED"
      ]
    },
    "content_sha256": {
      "pattern": "^[0-9a-f]{64}$",
      "type": "string"
    },
    "created_at": {
      "minLength": 10,
      "type": "string"
    },
    "package_id": {
      "const": "20260731-evidence-conservation-v2"
    },
    "prerequisite_state": {
      "enum": [
        "SATISFIED",
        "PENDING",
        "UNKNOWN",
        "FAILED"
      ]
    },
    "producer": {
      "additionalProperties": false,
      "properties": {
        "actor_id": {
          "const": "codex"
        },
        "role": {
          "const": "EVIDENCE_PACKAGE_GENERATOR"
        }
      },
      "required": [
        "actor_id",
        "role"
      ],
      "type": "object"
    },
    "record_id": {
      "minLength": 1,
      "type": "string"
    },
    "reviews": {
      "items": {
        "additionalProperties": false,
        "properties": {
          "completed_at": {
            "minLength": 10,
            "type": "string"
          },
          "decision": {
            "enum": [
              "APPROVE",
              "REJECT"
            ]
          },
          "independent": {
            "const": true
          },
          "receipt_id": {
            "pattern": "^review-[a-z0-9-]+$",
            "type": "string"
          },
          "review_type": {
            "enum": [
              "ORACLE_CONTRACT",
              "FIXTURE_REPRODUCIBILITY"
            ]
          },
          "reviewed_content_sha256": {
            "pattern": "^[0-9a-f]{64}$",
            "type": "string"
          },
          "reviewed_spec_sha256": {
            "pattern": "^[0-9a-f]{64}$",
            "type": "string"
          },
          "reviewer_id": {
            "pattern": "^v2-[a-z0-9-]+$",
            "type": "string"
          }
        },
        "required": [
          "receipt_id",
          "reviewer_id",
          "review_type",
          "decision",
          "reviewed_content_sha256",
          "reviewed_spec_sha256",
          "completed_at",
          "independent"
        ],
        "type": "object"
      },
      "type": "array",
      "uniqueItems": true
    },
    "schema": {
      "const": "CoverageDeltaV1"
    },
    "spec_sha256": {
      "pattern": "^[0-9a-f]{64}$",
      "type": "string"
    }
  },
  "required": [
    "schema",
    "record_id",
    "package_id",
    "candidate_state",
    "admission_state",
    "prerequisite_state",
    "created_at",
    "producer",
    "reviews",
    "spec_sha256",
    "content_sha256",
    "body"
  ],
  "title": "CoverageDeltaV1",
  "type": "object"
}
