{
  "admission_state": "PENDING_INDEPENDENT_REVIEW",
  "body": {
    "control_counts": {
      "covered": 3
    },
    "entries": [
      {
        "case_id": "P1-C",
        "classification": "COVERED_CONTROL",
        "review_status": "PENDING_INDEPENDENT_REVIEW",
        "supporting_references": [
          "PortfolioCommandCenter:src/portfolioTruthMutation.test.tsx::distinguishes a complete zero-finding observation from unknown coverage"
        ]
      },
      {
        "case_id": "P1-01",
        "classification": "COVERED",
        "review_status": "PENDING_INDEPENDENT_REVIEW",
        "supporting_references": [
          "GithubRepoAuditor:tests/test_portfolio_truth.py::test_receipt_partial_provider_coverage_emits_explicit_denominators"
        ]
      },
      {
        "case_id": "P1-02",
        "classification": "COVERED",
        "review_status": "PENDING_INDEPENDENT_REVIEW",
        "supporting_references": [
          "GithubRepoAuditor:tests/test_github_security_coverage.py::test_stale_provider_observation_becomes_unknown_count"
        ]
      },
      {
        "case_id": "P1-03",
        "classification": "PARTIAL",
        "review_status": "PENDING_INDEPENDENT_REVIEW",
        "supporting_references": [
          "GithubRepoAuditor:tests/test_github_security_coverage.py::test_malformed_provider_payload_has_exact_fail_closed_reason_code"
        ]
      },
      {
        "case_id": "P1-04",
        "classification": "PARTIAL",
        "review_status": "PENDING_INDEPENDENT_REVIEW",
        "supporting_references": [
          "GithubRepoAuditor:tests/test_github_security_coverage.py::test_total_request_ceiling_halts_incomplete_pagination"
        ]
      },
      {
        "case_id": "P1-05",
        "classification": "COVERED",
        "review_status": "PENDING_INDEPENDENT_REVIEW",
        "supporting_references": [
          "PortfolioCommandCenter:src/portfolioTruthMutation.test.tsx::fails closed on an unsupported complete-coverage receipt schema"
        ]
      },
      {
        "case_id": "P1-06",
        "classification": "CROSS",
        "review_status": "PENDING_INDEPENDENT_REVIEW",
        "supporting_references": [
          "GithubRepoAuditor:tests/test_github_security_coverage.py::test_receipt_producer_must_match_expected_canonical_commit",
          "PortfolioCommandCenter:src/validation.test.ts"
        ]
      },
      {
        "case_id": "P2-C",
        "classification": "COVERED_CONTROL",
        "review_status": "PENDING_INDEPENDENT_REVIEW",
        "supporting_references": [
          "mcp-trust:tests/test_refresh_candidate.py::test_deterministic_fixture_candidate_is_immutable_and_reviewable"
        ]
      },
      {
        "case_id": "P2-01",
        "classification": "COVERED",
        "review_status": "PENDING_INDEPENDENT_REVIEW",
        "supporting_references": [
          "mcp-trust:tests/test_refresh_candidate.py::test_missing_receipt_is_explicit_and_not_fresh"
        ]
      },
      {
        "case_id": "P2-02",
        "classification": "COVERED",
        "review_status": "PENDING_INDEPENDENT_REVIEW",
        "supporting_references": [
          "mcp-trust:tests/test_refresh_candidate.py::test_exact_expiry_boundary_is_stale"
        ]
      },
      {
        "case_id": "P2-03",
        "classification": "COVERED",
        "review_status": "PENDING_INDEPENDENT_REVIEW",
        "supporting_references": [
          "mcp-trust:tests/test_refresh_candidate.py::test_masked_grade_is_withheld_from_results_and_snapshot"
        ]
      },
      {
        "case_id": "P2-04",
        "classification": "COVERED",
        "review_status": "PENDING_INDEPENDENT_REVIEW",
        "supporting_references": [
          "mcp-trust:tests/test_refresh_candidate.py::fresh grade binding tests"
        ]
      },
      {
        "case_id": "P2-05",
        "classification": "PARTIAL",
        "review_status": "PENDING_INDEPENDENT_REVIEW",
        "supporting_references": [
          "mcp-trust:src/mcp_trust/refresh.py::_RECEIPT_KEYS verifier"
        ]
      },
      {
        "case_id": "P2-06",
        "classification": "PARTIAL",
        "review_status": "PENDING_INDEPENDENT_REVIEW",
        "supporting_references": [
          "mcp-trust:tests/test_receipt_provenance.py"
        ]
      },
      {
        "case_id": "P3-C",
        "classification": "COVERED_CONTROL",
        "review_status": "PENDING_INDEPENDENT_REVIEW",
        "supporting_references": [
          "bridge-db:tests/test_recovery.py::test_create_anchor_is_private_and_disposable_recovery_verifies"
        ]
      },
      {
        "case_id": "P3-01",
        "classification": "COVERED",
        "review_status": "PENDING_INDEPENDENT_REVIEW",
        "supporting_references": [
          "bridge-db:tests/test_cli.py::test_recovery_anchor_cli_fails_closed_when_missing"
        ]
      },
      {
        "case_id": "P3-02",
        "classification": "COVERED",
        "review_status": "PENDING_INDEPENDENT_REVIEW",
        "supporting_references": [
          "bridge-db:tests/test_recovery.py::test_anchor_inventory_becomes_stale_after_same_count_update"
        ]
      },
      {
        "case_id": "P3-03",
        "classification": "PARTIAL",
        "review_status": "PENDING_INDEPENDENT_REVIEW",
        "supporting_references": [
          "bridge-db:tests/test_recovery.py::test_anchor_detects_manifest_digest_mismatch"
        ]
      },
      {
        "case_id": "P3-04",
        "classification": "PARTIAL",
        "review_status": "PENDING_INDEPENDENT_REVIEW",
        "supporting_references": [
          "bridge-db:tests/test_recovery.py::test_anchor_detects_backup_tampering"
        ]
      },
      {
        "case_id": "P3-05",
        "classification": "COVERED",
        "review_status": "PENDING_INDEPENDENT_REVIEW",
        "supporting_references": [
          "bridge-db:tests/test_recovery.py::test_anchor_detects_incompatible_schema_even_with_rebound_digest"
        ]
      },
      {
        "case_id": "P3-06",
        "classification": "COVERED",
        "review_status": "PENDING_INDEPENDENT_REVIEW",
        "supporting_references": [
          "bridge-db:tests/test_recovery.py::test_anchor_reports_non_private_permissions_honestly[anchor.sqlite-0644-backup_permissions_not_private]"
        ]
      }
    ],
    "new_claim": "sealed independent oracle plus P1 subject binding seam only",
    "package_id": "20260731-evidence-conservation-v2",
    "primary_counts": {
      "covered": 11,
      "cross": 1,
      "partial": 6
    },
    "schema": "CoverageDeltaV1",
    "unmapped": 0
  },
  "candidate_state": "READY_FOR_INDEPENDENT_REVIEW",
  "content_sha256": "6c756dc9dc16b17babe614d923bf5eae8ba921d26c70cae0a9d838186b78127c",
  "created_at": "2026-07-31T21:27:04Z",
  "package_id": "20260731-evidence-conservation-v2",
  "prerequisite_state": "PENDING",
  "producer": {
    "actor_id": "codex",
    "role": "EVIDENCE_PACKAGE_GENERATOR"
  },
  "record_id": "coverage-delta-v2-20260731",
  "reviews": [],
  "schema": "CoverageDeltaV1",
  "spec_sha256": "1b23e6220d228a170a964c0e889d3d2fecd4ddc9ae4c46a73d8b13f927ed0c74"
}
